{
  "$schema": "https://json-schema.org/draft/2020-12/schema",
  "title": "Inventory response format 1.0.0",
  "description": "Generic envelope and answer tree for one inventory. Field types, IDs, conditions and validation must additionally be checked against the exact referenced protocol version.",
  "type": "object",
  "additionalProperties": false,
  "required": ["response_format_version", "response_id", "protocol_id", "protocol_version", "created_at", "updated_at", "answers", "resources"],
  "properties": {
    "response_format_version": { "const": "1.0.0" },
    "response_id": { "$ref": "#/$defs/instanceId" },
    "protocol_id": { "$ref": "#/$defs/definitionId" },
    "protocol_version": {
      "type": "string",
      "pattern": "^(0|[1-9][0-9]*)\\.(0|[1-9][0-9]*)\\.(0|[1-9][0-9]*)$"
    },
    "created_at": { "$ref": "#/$defs/timestamp" },
    "updated_at": { "$ref": "#/$defs/timestamp" },
    "answers": {
      "description": "Keys are section IDs. Omitted sections contain no recorded answers.",
      "type": "object",
      "propertyNames": { "$ref": "#/$defs/definitionId" },
      "additionalProperties": { "$ref": "#/$defs/scope" }
    },
    "resources": {
      "description": "Embedded binary resources keyed by resource ID, referenced by attachment field values.",
      "type": "object",
      "propertyNames": { "$ref": "#/$defs/definitionId" },
      "additionalProperties": { "$ref": "#/$defs/resource" }
    }
  },
  "$defs": {
    "definitionId": { "type": "string", "pattern": "^[a-z][a-z0-9_]*$" },
    "instanceId": {
      "description": "Stable UUID. Preserve through edits, exports and imports; generate a new UUID for a new inventory or record.",
      "type": "string",
      "format": "uuid",
      "pattern": "^[0-9a-f]{8}-[0-9a-f]{4}-[0-9a-f]{4}-[0-9a-f]{4}-[0-9a-f]{12}$"
    },
    "timestamp": {
      "type": "string",
      "format": "date-time",
      "pattern": "^\\d{4}-\\d{2}-\\d{2}T\\d{2}:\\d{2}:\\d{2}(?:\\.\\d+)?(?:Z|[+-]\\d{2}:\\d{2})$"
    },
    "value": {
      "description": "Actual type is defined by protocol.fields or an array items definition. No labels or display placeholders are substituted for values.",
      "oneOf": [
        { "type": "null" },
        { "type": "boolean" },
        { "type": "number" },
        { "type": "string" },
        { "type": "array", "items": { "$ref": "#/$defs/value" } },
        {
          "type": "object",
          "propertyNames": { "$ref": "#/$defs/definitionId" },
          "additionalProperties": { "$ref": "#/$defs/value" }
        }
      ]
    },
    "fieldValues": {
      "type": "object",
      "propertyNames": { "$ref": "#/$defs/definitionId" },
      "additionalProperties": { "$ref": "#/$defs/value" }
    },
    "groups": {
      "type": "object",
      "propertyNames": { "$ref": "#/$defs/definitionId" },
      "additionalProperties": {
        "oneOf": [
          { "$ref": "#/$defs/scope" },
          { "type": "array", "items": { "$ref": "#/$defs/record" } }
        ]
      }
    },
    "scope": {
      "description": "Section or non-repeatable group. Field references and groups must be direct children at this exact protocol path.",
      "type": "object",
      "additionalProperties": false,
      "required": ["fields", "groups"],
      "properties": {
        "fields": { "$ref": "#/$defs/fieldValues" },
        "groups": { "$ref": "#/$defs/groups" }
      }
    },
    "record": {
      "description": "One instance of a repeatable group. record_id must be unique across the inventory, including nested groups.",
      "type": "object",
      "additionalProperties": false,
      "required": ["record_id", "fields", "groups"],
      "properties": {
        "record_id": { "$ref": "#/$defs/instanceId" },
        "fields": { "$ref": "#/$defs/fieldValues" },
        "groups": { "$ref": "#/$defs/groups" }
      }
    },
    "resource": {
      "type": "object",
      "additionalProperties": false,
      "required": ["media_type", "encoding", "data"],
      "properties": {
        "media_type": {
          "description": "Lowercase MIME type without parameters. Must match the decoded content and the attachment_kind in the protocol.",
          "type": "string",
          "pattern": "^[a-z0-9][a-z0-9!#$&^_.+-]*/[a-z0-9][a-z0-9!#$&^_.+-]*$"
        },
        "encoding": { "const": "base64" },
        "data": {
          "description": "Standard padded base64, without whitespace or a data-URL prefix. The decoded resource must be nonempty and valid for its MIME type.",
          "type": "string",
          "minLength": 4,
          "pattern": "^(?:[A-Za-z0-9+/]{4})*(?:[A-Za-z0-9+/]{4}|[A-Za-z0-9+/]{2}==|[A-Za-z0-9+/]{3}=)$",
          "contentEncoding": "base64"
        },
        "filename": {
          "description": "Optional descriptive filename, never a filesystem path or a resource identifier.",
          "type": "string",
          "minLength": 1,
          "pattern": "^[^/\\\\\\u0000-\\u001f]+$"
        }
      }
    }
  }
}
